{
  "project": "ornek-proje",
  "title": "Örnek Bölüm — Uzaktan Çalışma ve Çalışan Refahı",
  "query": "Uzaktan çalışmanın çalışan refahı ve iş-yaşam dengesi üzerindeki etkileri",
  "generated_at": "2026-10-20",
  "target_count": 4,
  "notes": "Bu dosya yalnızca biçim örneğidir. Kayıtlar kurgusaldır; gerçek DOI veya yayıncı sayfası içermez. Kendi adaylarınızla değiştirin.",
  "candidates": [
    {
      "doi": "10.5555/example.2026.001",
      "title": "Uzaktan çalışma ve çalışan refahı: sistematik derleme",
      "authors": "Örnek, A.; Demo, B.; Test, C.",
      "year": 2026,
      "journal": "Journal of Example Work",
      "quartile": "Q1",
      "citations": 12,
      "open_access": true,
      "publisher": "ScienceDirect",
      "publisher_url": "https://www.sciencedirect.com/science/article/pii/EXAMPLE0001",
      "oa_pdf_url": "https://example.org/oa/example-0001.pdf",
      "priority": "A",
      "access": "Açık erişim",
      "rationale": "Uzaktan çalışma ile refah arasındaki ilişkiyi doğrudan sentezliyor."
    },
    {
      "doi": "10.5555/example.2025.002",
      "title": "Hibrit çalışma düzenlerinde iş-yaşam dengesi: boylamsal bulgular",
      "authors": "Demo, B.; Örnek, A.",
      "year": 2025,
      "journal": "Example Journal of Organizational Behavior",
      "quartile": "Q2",
      "citations": 34,
      "open_access": false,
      "publisher": "SpringerLink",
      "publisher_url": "https://link.springer.com/article/10.5555/example.2025.002",
      "oa_pdf_url": null,
      "priority": "A",
      "access": "Kurum erişimi",
      "rationale": "Hibrit düzenlerde zaman içindeki değişimi boylamsal veriyle gösteriyor."
    },
    {
      "doi": "10.5555/example.2024.003",
      "title": "Uzaktan çalışmada sınır yönetimi ve tükenmişlik",
      "authors": "Test, C.; Örnek, A.",
      "year": 2024,
      "journal": "Example Journal of Occupational Health",
      "quartile": "Q3",
      "citations": 7,
      "open_access": false,
      "publisher": "Wiley",
      "publisher_url": "https://onlinelibrary.wiley.com/doi/10.5555/example.2024.003",
      "oa_pdf_url": null,
      "priority": "B",
      "access": "Kurum erişimi",
      "rationale": "Sınır yönetimi mekanizması için nitel bağlam sağlıyor."
    },
    {
      "doi": "10.5555/example.2023.004",
      "title": "Çalışan refahı için örgütsel destek: kavramsal bir çerçeve",
      "authors": "Demo, B.; Test, C.",
      "year": 2023,
      "journal": "Example Review of Management",
      "quartile": "-",
      "citations": null,
      "open_access": true,
      "publisher": "Taylor & Francis",
      "publisher_url": "https://www.tandfonline.com/doi/full/10.5555/example.2023.004",
      "oa_pdf_url": "https://example.org/oa/example-0004.pdf",
      "priority": "C",
      "access": "Açık erişim",
      "rationale": "Kavramsal çerçeve; doğrudan veri değil, bağlam ve tanım desteği."
    }
  ]
}
